{
	"$schema": "https://xript.dev/schema/mod-manifest/v0.9.json",
	"xript": "0.9",
	"name": "status-panel",
	"version": "1.0.0",
	"title": "Status Panel",
	"description": "Contributes a status panel authored as a typed node tree rather than HTML.",
	"author": "xript-examples",
	"capabilities": ["ui-mount"],
	"fills": {
		"sidebar": [
			{
				"id": "session-status",
				"format": "application/x-panel+json",
				"source": "fragments/status.json",
				"priority": 10
			}
		]
	}
}
